{
  "artifact_type": "cost_constants",
  "schema_version": "1.0.0",
  "currency": "USD",
  "constants": {
    "claude-haiku-4-7": {
      "input_per_million_tokens": 0.25,
      "output_per_million_tokens": 1.25
    },
    "claude-sonnet-4-6": {
      "input_per_million_tokens": 3.00,
      "output_per_million_tokens": 15.00
    },
    "claude-opus-4-7": {
      "input_per_million_tokens": 15.00,
      "output_per_million_tokens": 75.00
    }
  },
  "last_updated": "2026-05-20T00:00:00Z"
}
